{
  "artifact_count": 49,
  "artifacts": [
    {
      "baseline_id": "AEB-1.0",
      "content_hash": {
        "algorithm": "SHA-256",
        "value": "02179537c0bdbff1c61fb827746c4cbc017cd229f40878e93a32e323bc0af88c"
      },
      "id": "R1",
      "owner": "enterprise-architecture",
      "source_path": "1/r1.txt",
      "status": "frozen",
      "type": "requirement_specification",
      "version": "1.0.0"
    },
    {
      "baseline_id": "AEB-1.0",
      "content_hash": {
        "algorithm": "SHA-256",
        "value": "12ca73363f6faccabb7b45f4c5dc8d1202768294512dc2f3650a6e0a765d9d4c"
      },
      "id": "R2",
      "owner": "enterprise-architecture",
      "source_path": "1/r2.txt",
      "status": "frozen",
      "type": "requirement_specification",
      "version": "1.0.0"
    },
    {
      "baseline_id": "AEB-1.0",
      "content_hash": {
        "algorithm": "SHA-256",
        "value": "a74262db87345edc4394f9c4b248207c48b28838c15d0eecd85634752e1a1834"
      },
      "id": "R3",
      "owner": "enterprise-architecture",
      "source_path": "1/r3.txt",
      "status": "frozen",
      "type": "requirement_specification",
      "version": "1.0.0"
    },
    {
      "baseline_id": "AEB-1.0",
      "content_hash": {
        "algorithm": "SHA-256",
        "value": "cd3537179d476f736e43dab949fe4a4428a1728cc389bd4d8691417d5bc22f4c"
      },
      "id": "R4",
      "owner": "enterprise-architecture",
      "source_path": "1/r4.txt",
      "status": "frozen",
      "type": "requirement_specification",
      "version": "1.0.0"
    },
    {
      "baseline_id": "AEB-1.0",
      "content_hash": {
        "algorithm": "SHA-256",
        "value": "f19b92df953541df6730c9f8489a6a384048b6b5ef762758269af6feed0311ec"
      },
      "id": "R5",
      "owner": "enterprise-architecture",
      "source_path": "1/r5.txt",
      "status": "frozen",
      "type": "requirement_specification",
      "version": "1.0.0"
    },
    {
      "baseline_id": "AEB-1.0",
      "content_hash": {
        "algorithm": "SHA-256",
        "value": "8f1df10edd5a8e149feae0ef335aaab521a5461fdb2a83926e7b70e41ec99299"
      },
      "id": "R6",
      "owner": "enterprise-architecture",
      "source_path": "1/r6.txt",
      "status": "frozen",
      "type": "requirement_specification",
      "version": "1.0.0"
    },
    {
      "baseline_id": "AEB-1.0",
      "content_hash": {
        "algorithm": "SHA-256",
        "value": "5e270a0e91d976b701dd43c4a62b5716ba686fabaefd8d03932000475b17350c"
      },
      "id": "R7",
      "owner": "enterprise-architecture",
      "source_path": "1/r7.txt",
      "status": "frozen",
      "type": "requirement_specification",
      "version": "1.0.0"
    },
    {
      "baseline_id": "AEB-1.0",
      "content_hash": {
        "algorithm": "SHA-256",
        "value": "b44283f8200b7d37e560fb28e9da478158ef7a10372bbc7e13f883801f865d75"
      },
      "id": "R8",
      "owner": "enterprise-architecture",
      "source_path": "1/r8.txt",
      "status": "frozen",
      "type": "requirement_specification",
      "version": "1.0.0"
    },
    {
      "baseline_id": "AEB-1.0",
      "content_hash": {
        "algorithm": "SHA-256",
        "value": "5145ab46548c4b7345fc535922ff931b0fca832591ba6b188d0b1256e66ec499"
      },
      "id": "R9",
      "owner": "enterprise-architecture",
      "source_path": "1/r9.txt",
      "status": "frozen",
      "type": "requirement_specification",
      "version": "1.0.0"
    },
    {
      "baseline_id": "AEB-1.0",
      "content_hash": {
        "algorithm": "SHA-256",
        "value": "aae36e317c0e33507d010fddf36489adc46f8bec76803fea31cb565facb5da6d"
      },
      "id": "R10",
      "owner": "enterprise-architecture",
      "source_path": "1/r10.txt",
      "status": "frozen",
      "type": "requirement_specification",
      "version": "1.0.0"
    },
    {
      "baseline_id": "AEB-1.0",
      "content_hash": {
        "algorithm": "SHA-256",
        "value": "7f1f80efeaa9df6bc059f8694f65b0c68f8b1f7dce894d2dd920af30e3d28ba2"
      },
      "id": "R11",
      "owner": "enterprise-architecture",
      "source_path": "1/r11.txt",
      "status": "frozen",
      "type": "requirement_specification",
      "version": "1.0.0"
    },
    {
      "baseline_id": "AEB-1.0",
      "content_hash": {
        "algorithm": "SHA-256",
        "value": "4f912a11ab833d3d72c9ec4e12bdbd9de7a103427e0bcb2eb293c8975066c5dd"
      },
      "id": "R12",
      "owner": "enterprise-architecture",
      "source_path": "1/r12.txt",
      "status": "frozen",
      "type": "requirement_specification",
      "version": "1.0.0"
    },
    {
      "baseline_id": "AEB-1.0",
      "content_hash": {
        "algorithm": "SHA-256",
        "value": "78f3eccaee3b163f2f740487260804157b8897576ab812e17e5d24e62caab7f3"
      },
      "id": "R13",
      "owner": "enterprise-architecture",
      "source_path": "1/r13.txt",
      "status": "frozen",
      "type": "requirement_specification",
      "version": "1.0.0"
    },
    {
      "baseline_id": "AEB-1.0",
      "content_hash": {
        "algorithm": "SHA-256",
        "value": "50e47ef2850f6960464a8e87dd0e58f4e1f7a0d3ca6be58731f3c370377e4cb4"
      },
      "id": "R14",
      "owner": "enterprise-architecture",
      "source_path": "1/r14.txt",
      "status": "frozen",
      "type": "requirement_specification",
      "version": "1.0.0"
    },
    {
      "baseline_id": "AEB-1.0",
      "content_hash": {
        "algorithm": "SHA-256",
        "value": "3c5b2ebfae8e89b60f7fbd9668aaf09c88557dc9cdb838bbb869ba00fe0b0265"
      },
      "id": "R15",
      "owner": "enterprise-architecture",
      "source_path": "1/r15.txt",
      "status": "frozen",
      "type": "requirement_specification",
      "version": "1.0.0"
    },
    {
      "baseline_id": "AEB-1.0",
      "content_hash": {
        "algorithm": "SHA-256",
        "value": "eae61b46f40c86e81b61ac240fb0dedcec490e8e07b650fd13aabfc421f7472f"
      },
      "id": "R16",
      "owner": "enterprise-architecture",
      "source_path": "1/r16.txt",
      "status": "frozen",
      "type": "requirement_specification",
      "version": "1.0.0"
    },
    {
      "baseline_id": "AEB-1.0",
      "content_hash": {
        "algorithm": "SHA-256",
        "value": "882d00cfae777e85d307ca4386ba2529ae91550d1b4029e8b4c12f85b3fa7fed"
      },
      "id": "R17",
      "owner": "enterprise-architecture",
      "source_path": "1/r17.txt",
      "status": "frozen",
      "type": "requirement_specification",
      "version": "1.0.0"
    },
    {
      "baseline_id": "AEB-1.0",
      "content_hash": {
        "algorithm": "SHA-256",
        "value": "1cef56eb40ecf97e510d70751894e35bde2e39f12a7631b6467e1ca4fe5bb743"
      },
      "id": "R18",
      "owner": "enterprise-architecture",
      "source_path": "1/r18.txt",
      "status": "frozen",
      "type": "requirement_specification",
      "version": "1.0.0"
    },
    {
      "baseline_id": "AEB-1.0",
      "content_hash": {
        "algorithm": "SHA-256",
        "value": "60aa6418eee35115da1cf77dd6a539dc005e08abcf7947aa14310e9f6860badc"
      },
      "id": "R19",
      "owner": "enterprise-architecture",
      "source_path": "1/r19.txt",
      "status": "frozen",
      "type": "requirement_specification",
      "version": "1.0.0"
    },
    {
      "baseline_id": "AEB-1.0",
      "content_hash": {
        "algorithm": "SHA-256",
        "value": "3791816dbeebb3f47dbbc4e6f519f49664f9812a128e64eae1401375a87d2139"
      },
      "id": "R20",
      "owner": "enterprise-architecture",
      "source_path": "1/r20.txt",
      "status": "frozen",
      "type": "requirement_specification",
      "version": "1.0.0"
    },
    {
      "baseline_id": "AEB-1.0",
      "content_hash": {
        "algorithm": "SHA-256",
        "value": "f1cf171d24d78ce4dcd6c80fa1a55c08bbc5d75014a30ba55527af1a203c642a"
      },
      "id": "R21",
      "owner": "enterprise-architecture",
      "source_path": "1/r21.txt",
      "status": "frozen",
      "type": "requirement_specification",
      "version": "1.0.0"
    },
    {
      "baseline_id": "AEB-1.0",
      "content_hash": {
        "algorithm": "SHA-256",
        "value": "ee92e0d8e329d67ec2ecf72c1ab4a92cf87d8d4b41554eb5636b0dd42cdbec4c"
      },
      "id": "R22",
      "owner": "enterprise-architecture",
      "source_path": "1/r22.txt",
      "status": "frozen",
      "type": "requirement_specification",
      "version": "1.0.0"
    },
    {
      "baseline_id": "AEB-1.0",
      "content_hash": {
        "algorithm": "SHA-256",
        "value": "3bf75cb7ae3cdf37d55ad01fba0bbfe1f1ad2a5fb42036a90fcb75a184b5a901"
      },
      "id": "R-INDEX",
      "owner": "enterprise-architecture",
      "source_path": "docs/R-INDEX.md",
      "status": "frozen",
      "type": "control_artifact",
      "version": "1.0.0"
    },
    {
      "baseline_id": "AEB-1.0",
      "content_hash": {
        "algorithm": "SHA-256",
        "value": "235bb49045ba7ddbc4349cef227a061b39aabc7608d4231ac6da3661c5ab976d"
      },
      "id": "AEB-1.0",
      "owner": "enterprise-architecture",
      "source_path": "docs/ARCHITECTURE-BASELINE-v1.0.md",
      "status": "frozen",
      "type": "control_artifact",
      "version": "1.0.0"
    },
    {
      "baseline_id": "AEB-1.0",
      "content_hash": {
        "algorithm": "SHA-256",
        "value": "737a22d0af489a6e8b9a9d534d0c8803c241cbca4b4010fc98c820c433624f15"
      },
      "id": "R-AUDIT-01",
      "owner": "enterprise-architecture",
      "source_path": "docs/R-AUDIT-01-current-state-repository-audit.md",
      "status": "frozen",
      "type": "audit_artifact",
      "version": "1.0.0"
    },
    {
      "baseline_id": "AEB-1.0",
      "content_hash": {
        "algorithm": "SHA-256",
        "value": "f9d71f7074271a08db992b5c697cde1bce9e036dc39ebfd9fa8c6a349f9aad61"
      },
      "id": "R-AUDIT-02",
      "owner": "enterprise-architecture",
      "source_path": "docs/R-AUDIT-02-r1-r22-alignment-matrix.md",